,,Paper associated ,Affiliation code,Afilliation name -,Intitute ,Country ,Discipline,Note (if applicable),,,,,,,,,,,,,,,,,,,,,,,,,,,,,,,,,,,,,,,,,,,,,,,,,,,,
,,p1,3,"Environment Assessment Group, Korea Environment Institute, Sejong",Korea Environment Institute,South Korea,STEM,,,,,,,,,,,,,,,,,,,,,,,,,,,,,,,,,,,,,,,,,,,,,,,,,,,,,
,,p1,2,"Department of Biology, KyungHee University, Seoul",KyungHee University,South Korea,STEM,,,,,,,,,,,,,,,,,,,,,,,,,,,,,,,,,,,,,,,,,,,,,,,,,,,,,
,,p1,4,"Korea Institute of Ornithology, KyungHee University, Seoul,",KyungHee University,South Korea,STEM,,,,,,,,,,,,,,,,,,,,,,,,,,,,,,,,,,,,,,,,,,,,,,,,,,,,,
,,p10,34,"Sydney School of Veterinary Science, Faculty of Science, The University of Sydney, Sydney, NSW, Australia",The University of Sydney,Australia,PH-VET,,,,,,,,,,,,,,,,,,,,,,,,,,,,,,,,,,,,,,,,,,,,,,,,,,,,,
,,p10,33,"Department of Veterinary and Animal Sciences, Faculty of Health and Medical Sciences, University of Copenhagen, Frederiksberg, Denmark",University of Copenhagen,Denmark,PH-VET,,,,,,,,,,,,,,,,,,,,,,,,,,,,,,,,,,,,,,,,,,,,,,,,,,,,,
,,p11,35,"Department of Epidemiology and Health statistics, School of Public Health, Fudan University, Shanghai, China",Fudan University,China,PH-EPI,,,,,,,,,,,,,,,,,,,,,,,,,,,,,,,,,,,,,,,,,,,,,,,,,,,,,
,,p11,38,"Jinshan District Center for Disease Control and Prevention, Shanghai, China",Jinshan District Center for Disease Control and Prevention,China,PH-VET,,,,,,,,,,,,,,,,,,,,,,,,,,,,,,,,,,,,,,,,,,,,,,,,,,,,,
,,p11,106,"Department of Animal Disease Control and Quarantine, Graduate School of Public Health, Korea University, Seoul, South Korea",Korea University,South Korea,PH-VET,,,,,,,,,,,,,,,,,,,,,,,,,,,,,,,,,,,,,,,,,,,,,,,,,,,,,
,,p11,35,"Department of Preventive Medicine, College of Medicine, Korea University, Seoul, South Korea ",Korea University,South Korea,PH-MED,,,,,,,,,,,,,,,,,,,,,,,,,,,,,,,,,,,,,,,,,,,,,,,,,,,,,
,,p11,36,"Transdisciplinary Major in Learning Health Systems, Department of Healthcare Sciences, Graduate School, Korea University, Seoul, South Korea",Korea University,South Korea,PH-MED,,,,,,,,,,,,,,,,,,,,,,,,,,,,,,,,,,,,,,,,,,,,,,,,,,,,,
,,p11,36,"Key Laboratory of Public Health Safety, Ministry of Education, Shanghai, China",Ministry of Education,China,PH-EPI,,,,,,,,,,,,,,,,,,,,,,,,,,,,,,,,,,,,,,,,,,,,,,,,,,,,,
,,p11,37," School of Veterinary Science, University of Sydney, Camden, NSW, Australia",University of Sydney,Australia,PH-EPI,,,,,,,,,,,,,,,,,,,,,,,,,,,,,,,,,,,,,,,,,,,,,,,,,,,,,
,,p12,41,"Agence Nationale de Sécurité Sanitaire de l’Alimentation, de l’Environnement et du Travail, Ploufragan, France",Agence Nationale de Sécurité Sanitaire de l’Alimentation-Ploufragan,France,STEM,,,,,,,,,,,,,,,,,,,,,,,,,,,,,,,,,,,,,,,,,,,,,,,,,,,,,
,,p12,42,"Direction Générale de l’Alimentation, Paris, France ",Direction Générale de l’Alimentation,France,PH-VET,,,,,,,,,,,,,,,,,,,,,,,,,,,,,,,,,,,,,,,,,,,,,,,,,,,,,
,,p12,43,"Department of Biosystems Science and Engineering, ETH Zurich, Basel, Switzerland",ETH Zurich,Switzerland,STEM,,,,,,,,,,,,,,,,,,,,,,,,,,,,,,,,,,,,,,,,,,,,,,,,,,,,,
,,p12,44,"Swiss Institute of Bioinformatics, Lausanne, Switzerland",Swiss Institute of Bioinformatics,Switzerland,STEM-Bioinformatics,,,,,,,,,,,,,,,,,,,,,,,,,,,,,,,,,,,,,,,,,,,,,,,,,,,,,
,,p12,39,"IHAP, Université de Toulouse, INRAE, ENVT, Toulouse, France",Université de Toulouse,France,PH-EPI,,,,,,,,,,,,,,,,,,,,,,,,,,,,,,,,,,,,,,,,,,,,,,,,,,,,,
,,p12,40,"Agence Nationale de Sécurité Sanitaire de l’Alimentation, de l’Environnement et du Travail, Université Paris-Est, Maisons-Alfort, France ",Université Paris-Est,France,PH-VET,,,,,,,,,,,,,,,,,,,,,,,,,,,,,,,,,,,,,,,,,,,,,,,,,,,,,
,,p13,46,"Department of Applied Mathematics and Institute of Statistics, Taichung 402, Taiwan ",Department of Applied Mathematics and Institute of Statistics,Taiwan,PH-VET,,,,,,,,,,,,,,,,,,,,,,,,,,,,,,,,,,,,,,,,,,,,,,,,,,,,,
,,p13,45,"Graduate Institute of Microbiology and Public Health, College of Veterinary Medicine, National Chung Hsing University, 145 Xingda Rd., Taichung 402, Taiwan",National Chung Hsing University,Taiwan,STEM,,,,,,,,,,,,,,,,,,,,,,,,,,,,,,,,,,,,,,,,,,,,,,,,,,,,,
,,p14,48,"Division of Veterinary Epidemiology, Animal and Plant Quarantine Agency, Gimcheon 39660, Korea",Animal and Plant Quarantine Agency,South Korea,PH-EPI,,,,,,,,,,,,,,,,,,,,,,,,,,,,,,,,,,,,,,,,,,,,,,,,,,,,,
,,p14,47,"Veterinary Public Health Lab, College of Veterinary Medicine, Chonnam National University, Gwangju 61186, Korea",Chonnam National University,South Korea,PH-VET,,,,,,,,,,,,,,,,,,,,,,,,,,,,,,,,,,,,,,,,,,,,,,,,,,,,,
,,p15,71,"Vaccine and Infectious Disease, Fred Hutchinson Cancer Research Centre, Seattle, Washington, USA",Fred Hutchinson Cancer Research Centre,United States,PH-EPI,,,,,,,,,,,,,,,,,,,,,,,,,,,,,,,,,,,,,,,,,,,,,,,,,,,,,
,,p16,50,"San Jose State University Research Foundation, Moss Landing Marine Laboratories, California, USAc",San Jose State University Research Foundation,United States,PH-VET,,,,,,,,,,,,,,,,,,,,,,,,,,,,,,,,,,,,,,,,,,,,,,,,,,,,,
,,p16,52,"Suisun Resource Conservation District, Suisun Marsh Program, West Sacramento, California, USA",Suisun Resource Conservation District,United States,PH-VET,,,,,,,,,,,,,,,,,,,,,,,,,,,,,,,,,,,,,,,,,,,,,,,,,,,,,
,,p16,53,"University of California Davis, School of Veterinary Medicine, Poultry Health and Food Safety Epidemiology, One Shields Avenue, Davis, California, USA",University of California Davis,United States,STEM,,,,,,,,,,,,,,,,,,,,,,,,,,,,,,,,,,,,,,,,,,,,,,,,,,,,,
,,p17,57,"Key Laboratory of Zoonoses Prevention and Control of Guangdong Province, Guangzhou, China",Key Laboratory of Zoonoses Prevention and Control of Guangdong Province,China,PH-EPI,,,,,,,,,,,,,,,,,,,,,,,,,,,,,,,,,,,,,,,,,,,,,,,,,,,,,
,,p17,56,"Key Laboratory of Zoonosis, Key Laboratory of Animal Vaccine Development, Ministry of Agriculture and Rural Affairs, Guangzhou, China ",Ministry of Agriculture and Rural Affairs,China,PH-EPI,,,,,,,,,,,,,,,,,,,,,,,,,,,,,,,,,,,,,,,,,,,,,,,,,,,,,
,,p17,55,"National Avian Influenza Para-Reference Laboratory, College of Veterinary Medicine, South China Agricultural University, Guangzhou, China",South China Agricultural University,China,PH-EPI,,,,,,,,,,,,,,,,,,,,,,,,,,,,,,,,,,,,,,,,,,,,,,,,,,,,,
,,p18,58,"School of Population Medicine and Public Health, Chinese Academy of Medical Science & Peking Union Medical College, Beijing, China",Chinese Academy of Medical Science & Peking Union Medical College,China,PH-MED,,,,,,,,,,,,,,,,,,,,,,,,,,,,,,,,,,,,,,,,,,,,,,,,,,,,,
,,p18,59,"Department of Influenza, WHO Collaborating Centre for Reference and Research on Influenza, Chinese National Influenza Centre, National Institute for Viral Disease Control and Prevention, Chinese Centre for Disease Control and Prevention, Beijing, China",Chinese Centre for Disease Control and Prevention,China,PH-EPI,,,,,,,,,,,,,,,,,,,,,,,,,,,,,,,,,,,,,,,,,,,,,,,,,,,,,
,,p19,60,"Department of Disease Control and Epidemiology, National Veterinary Institute, 751 89 Uppsala, Sweden",National Veterinary Institute,Sweden,PH-VET,,,,,,,,,,,,,,,,,,,,,,,,,,,,,,,,,,,,,,,,,,,,,,,,,,,,,
,,p19,62,"Department of Pathology and Wildlife Diseases, National Veterinary Institute, 751 89 Uppsala, Sweden;",National Veterinary Institute,Sweden,PH-VET,,,,,,,,,,,,,,,,,,,,,,,,,,,,,,,,,,,,,,,,,,,,,,,,,,,,,
,,p19,63,"Department of Microbiology, National Veterinary Institute, 751 89 Uppsala, Sweden",National Veterinary Institute,Sweden,PH-VET,,,,,,,,,,,,,,,,,,,,,,,,,,,,,,,,,,,,,,,,,,,,,,,,,,,,,
,,p19,64,"Department of Animal Health and Antimicrobial Strategies, National Veterinary Institute,
751 89 Uppsala, Sweden",National Veterinary Institute,Sweden,PH-VET,,,,,,,,,,,,,,,,,,,,,,,,,,,,,,,,,,,,,,,,,,,,,,,,,,,,,
,,p19,61,"Department of Clinical Sciences, Swedish University of Agricultural Sciences, 750 07 Uppsala, Sweden",Swedish University of Agricultural Sciences,Sweden,PH-EPI,,,,,,,,,,,,,,,,,,,,,,,,,,,,,,,,,,,,,,,,,,,,,,,,,,,,,
,,p2,77,"Department of Public Health, College of Medicine, Korea University, Seoul",Korea University,South Korea,PH-MED,,,,,,,,,,,,,,,,,,,,,,,,,,,,,,,,,,,,,,,,,,,,,,,,,,,,,
,,p2,5,"Center for Animal Disease Modeling and Surveillance (CADMS), Department of Medicine and Epidemiology, School of Veterinary Medicine, University of California, Davis, California, USA ",University of California,United States,PH-EPI,,,,,,,,,,,,,,,,,,,,,,,,,,,,,,,,,,,,,,,,,,,,,,,,,,,,,
,,p2,6,"One Health Institute, School of Veterinary Medicine, University of California, Davis, California, USA",University of California,United States,PH-VET,,,,,,,,,,,,,,,,,,,,,,,,,,,,,,,,,,,,,,,,,,,,,,,,,,,,,
,,p20,65,"State Key Laboratory of Veterinary Biotechnology, Harbin Veterinary Research Institute, Chinese Academy of Agricultural Sciences, Harbin 150069, China;",Chinese Academy of Agricultural Sciences,China,STEM,,,,,,,,,,,,,,,,,,,,,,,,,,,,,,,,,,,,,,,,,,,,,,,,,,,,,
,,p20,72," French Agency for Food, Environmental and Occupational Health & Safety (ANSES) Laboratory of Ploufragan-Plouzané-Niort, Ploufragan, France","French Agency for Food, Environmental and Occupational Health & Safety (ANSES) Laboratory of Ploufragan-Plouzané-Niort",France,STEM,,,,,,,,,,,,,,,,,,,,,,,,,,,,,,,,,,,,,,,,,,,,,,,,,,,,,
,,p20,67,"Guangdong Laboratory for Lingnan Modern Agriculture, Guangzhou 510642, China",Guangdong Laboratory for Lingnan Modern Agriculture,China,STEM,note: Diagnostic Virologist,,,,,,,,,,,,,,,,,,,,,,,,,,,,,,,,,,,,,,,,,,,,,,,,,,,,
,,p20,66,"College of Agronomy, Liaocheng University, Liaocheng 252000, China;",Liaocheng University,China,SHAPE,,,,,,,,,,,,,,,,,,,,,,,,,,,,,,,,,,,,,,,,,,,,,,,,,,,,,
,,p21,84,"Ausvet Europe, Lyon, France",Ausvet Europe,France,PH-EPI,,,,,,,,,,,,,,,,,,,,,,,,,,,,,,,,,,,,,,,,,,,,,,,,,,,,,
,,p21,83,"Looking out for Birds (BTO) Scotland, Stirling, UK",BTO Scotland,United Kingdom,STEM,,,,,,,,,,,,,,,,,,,,,,,,,,,,,,,,,,,,,,,,,,,,,,,,,,,,,
,,p21,86,"Looking out for Birds (BTO), Thetford, UK",BTO Thetford,United Kingdom,STEM,,,,,,,,,,,,,,,,,,,,,,,,,,,,,,,,,,,,,,,,,,,,,,,,,,,,,
,,p21,81,"Catalan Ornithological Institute, Barcelona, Spain ",Catalan Ornithological Institute,Spain,STEM,,,,,,,,,,,,,,,,,,,,,,,,,,,,,,,,,,,,,,,,,,,,,,,,,,,,,
,,p21,85,"Sovon, Dutch Centre for Field Ornithology, Nijmegen, Netherlands",Dutch Centre for Field Ornithology,Netherlands,STEM,,,,,,,,,,,,,,,,,,,,,,,,,,,,,,,,,,,,,,,,,,,,,,,,,,,,,
,,p21,82,"EuroBirdPortal/EBCC, Barcelona, Spain",EuroBirdPortal/EBCC,Spain,STEM,,,,,,,,,,,,,,,,,,,,,,,,,,,,,,,,,,,,,,,,,,,,,,,,,,,,,
,,p21,87,"EURING, Thetford, UK",The EURING bank,United Kingdom,STEM,,,,,,,,,,,,,,,,,,,,,,,,,,,,,,,,,,,,,,,,,,,,,,,,,,,,,
,,p22,89,"Department of Virus & Microbiological Special Diagnostics, Statens Serum Institut, Copenhagen, Denmark",Statens Serum Institut,Denmark,STEM,,,,,,,,,,,,,,,,,,,,,,,,,,,,,,,,,,,,,,,,,,,,,,,,,,,,,
,,p22,88,"Faculty of Health and Medical Sciences, Section for Animal Welfare and Disease Control, Department of Veterinary and Animal Sciences, University of Copenhagen, Frederiksberg, Denmark",University of Copenhagen,Denmark,PH-VET,,,,,,,,,,,,,,,,,,,,,,,,,,,,,,,,,,,,,,,,,,,,,,,,,,,,,
,,p22,90,"Faculty of Science, Sydney School of Veterinary Science, The University of Sydney, Camden NSW, Australia",University of Sydney,Australia,PH-VET,,,,,,,,,,,,,,,,,,,,,,,,,,,,,,,,,,,,,,,,,,,,,,,,,,,,,
,,p23,97,"China Animal Health and Epidemiology
Centre, Qingdao, China","China Animal Health and Epidemiology
Centre",China,PH-EPI,,,,,,,,,,,,,,,,,,,,,,,,,,,,,,,,,,,,,,,,,,,,,,,,,,,,,
,,p23,100,"Guangxi Centre of Animal Disease Prevention and Control, Nanning, China",Guangxi Centre of Animal Disease Prevention and Control,China,PH-EPI,,,,,,,,,,,,,,,,,,,,,,,,,,,,,,,,,,,,,,,,,,,,,,,,,,,,,
,,p23,102,"Hubei International Scientific and Technological Cooperation Base of Veterinary Epidemiology, Huazhong Agricultural University, Wuhan, China",Huazhong Agricultural University,China,PH-EPI,,,,,,,,,,,,,,,,,,,,,,,,,,,,,,,,,,,,,,,,,,,,,,,,,,,,,
,,p23,98,"School of Veterinary Medicine, Murdoch University, Perth, Australia",Murdoch University,Australia,PH-VET,,,,,,,,,,,,,,,,,,,,,,,,,,,,,,,,,,,,,,,,,,,,,,,,,,,,,
,,p23,99,"Royal Veterinary College, University of London, Hatfield, UK",Murdoch University,United Kingdom,PH-VET,,,,,,,,,,,,,,,,,,,,,,,,,,,,,,,,,,,,,,,,,,,,,,,,,,,,,
,,p23,103,"Centre for Biosecurity and One Health, Harry Butler Institute, Murdoch University, Perth, Australia",Murdoch University ,Australia,STEM,,,,,,,,,,,,,,,,,,,,,,,,,,,,,,,,,,,,,,,,,,,,,,,,,,,,,
,,p23,101,"China Australia Joint Laboratory for Animal Health Big Data Analytics, College of Animal Science and Technology, Zhejiang Agricultural and Forestry University, Hangzhou, China",Zhejiang Agricultural and Forestry University ,China,PH-VET,,,,,,,,,,,,,,,,,,,,,,,,,,,,,,,,,,,,,,,,,,,,,,,,,,,,,
,,p25,111,"Department of Biology, Frostburg State University, Frostburg, Maryland, USA ",Frostburg State University ,United States,STEM-Biology,,,,,,,,,,,,,,,,,,,,,,,,,,,,,,,,,,,,,,,,,,,,,,,,,,,,,
,,p25,112,"US Department of Agriculture, Wildlife Services, National Wildlife Disease Program, Fort Collins, Colorado, USA",US Department of Agriculture,United States,STEM-Ecology,,,,,,,,,,,,,,,,,,,,,,,,,,,,,,,,,,,,,,,,,,,,,,,,,,,,,
,,p26,116,"Faculty of Veterinary Medicine, Chattogram Veterinary and Animal Sciences University, Chattogram 4225, Bangladesh",Chattogram Veterinary and Animal Sciences University,Bangladesh,PH-VET,,,,,,,,,,,,,,,,,,,,,,,,,,,,,,,,,,,,,,,,,,,,,,,,,,,,,
,,p26,109,"Centre for Integrative Ecology, School of Life and Environmental Sciences, Deakin University, Geelong, Victoria,
VIC 3216, Australia",Deakin University,Australia,STEM-Ecology,,,,,,,,,,,,,,,,,,,,,,,,,,,,,,,,,,,,,,,,,,,,,,,,,,,,,
,,p26,114,"Institute of Epidemiology, Disease Control and Research (IEDCR), Dhaka 1212, Bangladesh",Disease Control and Research (IEDCR),Bangladesh,PH-EPI,,,,,,,,,,,,,,,,,,,,,,,,,,,,,,,,,,,,,,,,,,,,,,,,,,,,,
,,p26,108,"EcoHealth Alliance, New York, NY 10018, USA",EcoHealth Alliance,United States,STEM-Ecology,,,,,,,,,,,,,,,,,,,,,,,,,,,,,,,,,,,,,,,,,,,,,,,,,,,,,
,,p26,115,"Queensland Alliance for One Health Sciences, School of Veterinary Science, The University of Queensland, Brisbane,
QLD 4343, Australia",The University of Queensland,Australia,PH-VET,,,,,,,,,,,,,,,,,,,,,,,,,,,,,,,,,,,,,,,,,,,,,,,,,,,,,
,,p27,117,"Honam National Institute of Biological Resources, Mokpo 58762, Korea",Honam National Institute of Biological Resources,South Korea,STEM-Biology,,,,,,,,,,,,,,,,,,,,,,,,,,,,,,,,,,,,,,,,,,,,,,,,,,,,,
,,p28,122,"Key Laboratory of Public Health Safety, Ministry of Education, 
School of Public Health, Fudan University, 200032 Shanghai, China, ",Fudan University,China,PH-MED,,,,,,,,,,,,,,,,,,,,,,,,,,,,,,,,,,,,,,,,,,,,,,,,,,,,,
,,p28,119,"Department of Ecology and Evolutionary Biology, Princeton University, Princeton, NJ 08544",Princeton University,United States,STEM-Ecology,,,,,,,,,,,,,,,,,,,,,,,,,,,,,,,,,,,,,,,,,,,,,,,,,,,,,
,,p28,121,"Unit of Host-Pathogens Interactions, University of Toulouse, National Research Institute for Agriculture, Food and the Environment, National Veterinary School of Toulouse, 31300 Toulouse, France",University of Toulouse,France,PH-VET,,,,,,,,,,,,,,,,,,,,,,,,,,,,,,,,,,,,,,,,,,,,,,,,,,,,,
,,p29,95,"Laboratory for Animal Health, French Agency for Food, Environmental and Occupational Health and Safety (ANSES), University Paris-Est, 14 rue Pierre et Marie Curie, 94700 Maisons-Alfort, France ",University of Paris,France,PH-VET,,,,,,,,,,,,,,,,,,,,,,,,,,,,,,,,,,,,,,,,,,,,,,,,,,,,,
,,p29,96,"Mathematical Modelling of Infectious Diseases Unit, Institut Pasteur, Université de Paris Cité, CNRS UMR2000, 75015 Paris, France ",University of Paris,France,STEM,,,,,,,,,,,,,,,,,,,,,,,,,,,,,,,,,,,,,,,,,,,,,,,,,,,,,
,,p3,8,"Institute of Land Surface System and Sustainable Development, Faculty of Geographical Science, Beijing Normal University, Beijing 100875, China
",Beijing Normal University,China,STEM,,,,,,,,,,,,,,,,,,,,,,,,,,,,,,,,,,,,,,,,,,,,,,,,,,,,,
,,p3,9,"State Key Laboratory of Earth Surface Processes
and Resource Ecology, Faculty of Geographical Science, Beijing Normal University, Beijing 100875, China",Beijing Normal University,China,PH-VET,,,,,,,,,,,,,,,,,,,,,,,,,,,,,,,,,,,,,,,,,,,,,,,,,,,,,
,,p3,7,"College of Geoscience and Surveying Engineering, University of Mining & Technology, Beijing 100083, China
",University of Mining & Technology,China,PH-VET,,,,,,,,,,,,,,,,,,,,,,,,,,,,,,,,,,,,,,,,,,,,,,,,,,,,,
,,p31,104,"Department of Statistics, Graduate School, Hankuk University of Foreign Studies, Seoul, Republic of Korea",Hankuk University of Foreign Studies,South Korea,STEM,,,,,,,,,,,,,,,,,,,,,,,,,,,,,,,,,,,,,,,,,,,,,,,,,,,,,
,,p32,123,"Institute of Diagnostic Virology, Friedrich-Loeffler-Institut, 17493 Greifswald-Insel Riems, Germany ",Friedrich-Loeffler-Institut,Germany,PH-VET,,,,,,,,,,,,,,,,,,,,,,,,,,,,,,,,,,,,,,,,,,,,,,,,,,,,,
,,p32,124,"Institute of Epidemiology, Friedrich-Loeffler-Institut, 17493 Greifswald-Insel Riems, Germany ",Friedrich-Loeffler-Institut,Germany,PH-EPI,,,,,,,,,,,,,,,,,,,,,,,,,,,,,,,,,,,,,,,,,,,,,,,,,,,,,
,,p32,125,"Institute for International Animal Health/One Health, Friedrich-Loeffler-Institut,
17493 Greifswald-Insel Riems, Germany",Friedrich-Loeffler-Institut,Germany,PH-VET,,,,,,,,,,,,,,,,,,,,,,,,,,,,,,,,,,,,,,,,,,,,,,,,,,,,,
,,p33,130,"Federal Agency for the Safety of the Food Chain, Brussels ",Federal Agency for the Safety of the Food Chain,Belgium ,PH-EPI,,,,,,,,,,,,,,,,,,,,,,,,,,,,,,,,,,,,,,,,,,,,,,,,,,,,,
,,p33,127,"Rega Institute KU Leuven, Leuven, Belgium ",Rega Institute KU Leuven,Belgium ,PH-EPI,,,,,,,,,,,,,,,,,,,,,,,,,,,,,,,,,,,,,,,,,,,,,,,,,,,,,
,,p33,129,"Royal Meteorological Institute of Belgium, Uccle, Belgium",Royal Meteorological Institute of Belgium,Belgium ,STEM,,,,,,,,,,,,,,,,,,,,,,,,,,,,,,,,,,,,,,,,,,,,,,,,,,,,,
,,p33,126,"Sciensano, Brussels, Belgium ",Sciensano,Belgium ,PH-VET,,,,,,,,,,,,,,,,,,,,,,,,,,,,,,,,,,,,,,,,,,,,,,,,,,,,,
,,p33,128,"Université Libre de Bruxelles, Brussels ",Université Libre de Bruxelles,Belgium ,PH-EPI,,,,,,,,,,,,,,,,,,,,,,,,,,,,,,,,,,,,,,,,,,,,,,,,,,,,,
,,p34,94,"Sovon, Dutch Centre for Field Ornithology, 6525 ED Nijmegen, The Netherlands",Dutch Centre for Field Ornithology,Netherlands,STEM-Ecology,,,,,,,,,,,,,,,,,,,,,,,,,,,,,,,,,,,,,,,,,,,,,,,,,,,,,
,,p34,91,"Department of Population Health Sciences, Faculty of Veterinary Medicine, Utrecht University,
3584 CL Utrecht, The Netherlands",Utrecht University,Netherlands,PH-VET,,,,,,,,,,,,,,,,,,,,,,,,,,,,,,,,,,,,,,,,,,,,,,,,,,,,,
,,p34,93,"Department of Epidemiology, Bioinformatics and Animal Models, Wageningen Bioveterinary Research, 8221 RA Lelystad, The Netherlands ",Wageningen Bioveterinary Research,Netherlands,PH-EPI,,,,,,,,,,,,,,,,,,,,,,,,,,,,,,,,,,,,,,,,,,,,,,,,,,,,,
,,p34,92,"Wildlife Ecology and Conservation Group, Wageningen University & Research,
6708 PB Wageningen, The Netherlands",Wageningen University,Netherlands,STEM-Ecology,,,,,,,,,,,,,,,,,,,,,,,,,,,,,,,,,,,,,,,,,,,,,,,,,,,,,
,,p35,19,"U.S. Geological Survey, Alaska Science Center, Anchorage, Alaska, United States of America,",Alaska Science Center,United States,STEM-Ecology,,,,,,,,,,,,,,,,,,,,,,,,,,,,,,,,,,,,,,,,,,,,,,,,,,,,,
,,p35,110,"U.S. Fish and Wildlife Service, Chesapeake Bay Field Office, Annapolis, Maryland, United States of America ",Fish and Wildlife Service,United States,STEM,,,,,,,,,,,,,,,,,,,,,,,,,,,,,,,,,,,,,,,,,,,,,,,,,,,,,
,,p35,78,"U.S. Geological Survey, National Wildlife Health Center, Madison, Wisconsin, United States of America,",National Wildlife Health Center - Madison,United States,STEM-Ecology,,,,,,,,,,,,,,,,,,,,,,,,,,,,,,,,,,,,,,,,,,,,,,,,,,,,,
,,p35,49,"Center for Ecology of Infectious Diseases, Department of Infectious Diseases, Department of Epidemiology and Biostatistics, Institute of Bioinformatics, University of Georgia, Athens, Georgia, United States of America",University of Georgia,United States,PH-EPI,,,,,,,,,,,,,,,,,,,,,,,,,,,,,,,,,,,,,,,,,,,,,,,,,,,,,
,,p35,113,"Southeastern Cooperative Wildlife Disease Study, Department of Population Health, College of Veterinary Medicine, University of Georgia, Athens, Georgia, United States of America ",University of Georgia,United States,PH-EPI,,,,,,,,,,,,,,,,,,,,,,,,,,,,,,,,,,,,,,,,,,,,,,,,,,,,,
,,p4,12,"Astronomy and Meteorology Department, Faculty of Science, Al-Azhar University, Cairo, Egypt.",Al-Azhar University,Egypt,PH-VET,,,,,,,,,,,,,,,,,,,,,,,,,,,,,,,,,,,,,,,,,,,,,,,,,,,,,
,,p4,16,"Department of Animal Hygiene and Preventive Medicine, Faculty of Veterinary Medicine, Kafrelsheikh University, Kafrelsheikh, Egypt. ",Kafrelsheikh University,Egypt,PH-VET,,,,,,,,,,,,,,,,,,,,,,,,,,,,,,,,,,,,,,,,,,,,,,,,,,,,,
,,p4,11,"College of Agriculture, Environment and Nutrition Sciences, Tuskegee University, Tuskegee, AL, USA.",Tuskegee University,United States,PH-VET,,,,,,,,,,,,,,,,,,,,,,,,,,,,,,,,,,,,,,,,,,,,,,,,,,,,,
,,p4,14,"Department of Biomedical Sciences, College of Veterinary Medicine, Tuskegee University, Tuskegee, AL, USA",Tuskegee University,United States,STEM-Biology,,,,,,,,,,,,,,,,,,,,,,,,,,,,,,,,,,,,,,,,,,,,,,,,,,,,,
,,p4,15,"Global Academy of Agriculture and Food Security, The Royal (Dick) School of Veterinary Studies, University
of Edinburgh, Easter Bush Campus, Midlothian EH25 9RG, UK.",University of Edinburgh,United Kingdom,STEM,,,,,,,,,,,,,,,,,,,,,,,,,,,,,,,,,,,,,,,,,,,,,,,,,,,,,
,,p4,10,"Department of Hygiene and Zoonosis, Faculty of Veterinary Medicine, University of Sadat City, Menofia, Sadat City 32897, Egypt",University of Sadat City,Egypt,PH-VET,,,,,,,,,,,,,,,,,,,,,,,,,,,,,,,,,,,,,,,,,,,,,,,,,,,,,
,,p4,13,"Department of Animal Medicine and Infectious Diseases, Faculty of Veterinary Medicine, University of Sadat City, Sadat City, Menofia 32897, Egypt.",University of Sadat City,Egypt,STEM,,,,,,,,,,,,,,,,,,,,,,,,,,,,,,,,,,,,,,,,,,,,,,,,,,,,,
,,p5,19,"U.S. Geological Survey, Alaska Science Center, Anchorage, AK, USA ",Alaska Science Center,United States,PH-EPI,,,,,,,,,,,,,,,,,,,,,,,,,,,,,,,,,,,,,,,,,,,,,,,,,,,,,
,,p5,76,"Department of Biological Sciences, California State University Chico, Chico, CA, USA.",California State University Chico,United States,STEM-Biology,,,,,,,,,,,,,,,,,,,,,,,,,,,,,,,,,,,,,,,,,,,,,,,,,,,,,
,,p5,18,"U.S. Geological Survey, Eastern Ecological Science Center, Laurel, Maryland, USA",Eastern Ecological Science Center - Maryland,United States,STEM-Ecology,,,,,,,,,,,,,,,,,,,,,,,,,,,,,,,,,,,,,,,,,,,,,,,,,,,,,
,,p5,78,"U.S. Geological Survey, National Wildlife Health Center, Madison, WI, USA ",National Wildlife Health Center - Madison,United States,PH-EPI,,,,,,,,,,,,,,,,,,,,,,,,,,,,,,,,,,,,,,,,,,,,,,,,,,,,,
,,p5,22,"Department of Agriculture, Wildlife Services, National Wildlife Research Center, Fort Collins, CO, USA.",National Wildlife Research Center - Fort Collins,United States,PH-VET,,,,,,,,,,,,,,,,,,,,,,,,,,,,,,,,,,,,,,,,,,,,,,,,,,,,,
,,p5,80,"Department of Infectious Diseases, St. Jude Children’s Research Hospital, Memphis, TN, USA.",St. Jude Children’s Research Hospital,United States,PH-VET,,,,,,,,,,,,,,,,,,,,,,,,,,,,,,,,,,,,,,,,,,,,,,,,,,,,,
,,p5,73,"Department of Veterinary Preventive Medicine, The Ohio State University, Columbus, OH, USA.",The Ohio State University,United States,STEM,,,,,,,,,,,,,,,,,,,,,,,,,,,,,,,,,,,,,,,,,,,,,,,,,,,,,
,,p5,23,"Department of Veterinary Preventive Medicine, The Ohio State University, Columbus, OH, USA. 8School of Veterinary Medicine, University of California Davis, Davis, CA, USA",University of California Davis,United States,PH-EPI,,,,,,,,,,,,,,,,,,,,,,,,,,,,,,,,,,,,,,,,,,,,,,,,,,,,,
,,p5,74,"School of Veterinary Medicine, University of California Davis, Davis, CA, USA",University of California Davis,United States,PH-VET,,,,,,,,,,,,,,,,,,,,,,,,,,,,,,,,,,,,,,,,,,,,,,,,,,,,,
,,p5,21,"Department of Infectious Diseases, University of Georgia, Athens, GA, USA.",University of Georgia,United States,PH-VET,,,,,,,,,,,,,,,,,,,,,,,,,,,,,,,,,,,,,,,,,,,,,,,,,,,,,
,,p5,17,"Department of Environmental Science and Technology, University of Maryland, College Park, MD, USA",University of Maryland,United States,STEM,,,,,,,,,,,,,,,,,,,,,,,,,,,,,,,,,,,,,,,,,,,,,,,,,,,,,
,,p5,79,"Department of Biology, University of Massachusetts, Boston, MA, USA.",University of Massachusetts,United States,STEM-Biology,,,,,,,,,,,,,,,,,,,,,,,,,,,,,,,,,,,,,,,,,,,,,,,,,,,,,
,,p5,75,"Department of Veterinary and Biomedical Sciences, University of Minnesota, St. Paul, MN, USA.",University of Minnesota,United States,PH-VET,,,,,,,,,,,,,,,,,,,,,,,,,,,,,,,,,,,,,,,,,,,,,,,,,,,,,
,,p5,54,"U.S. Geological Survey, San Francisco Bay Estuary Field Station, Western Ecological Research Center, Moffett Field, CA, USA.",Western Ecological Research Center - California,United States,STEM-Ecology,,,,,,,,,,,,,,,,,,,,,,,,,,,,,,,,,,,,,,,,,,,,,,,,,,,,,
,,p5,20,"U.S. Geological Survey, Western Ecological Research Center, Dixon Field Station, Dixon, CA, USA",Western Ecological Research Center -Dixon,United States,STEM-Ecology,,,,,,,,,,,,,,,,,,,,,,,,,,,,,,,,,,,,,,,,,,,,,,,,,,,,,
,,p6,69,Matrouh University,Matrouh University ,Egypt,STEM,,,,,,,,,,,,,,,,,,,,,,,,,,,,,,,,,,,,,,,,,,,,,,,,,,,,,
,,p6,68,Royal Holloway University of London,Royal Holloway University of London,United Kingdom,PH-EPI,,,,,,,,,,,,,,,,,,,,,,,,,,,,,,,,,,,,,,,,,,,,,,,,,,,,,
,,p7,24,"Sustainability Research Center & PhD in Conservation Medicine, Life Science Faculty, Universidad Andrés Bello, República 440, Santiago, Chile",Universidad Andrés Bello ,Chile,PH-VET,,,,,,,,,,,,,,,,,,,,,,,,,,,,,,,,,,,,,,,,,,,,,,,,,,,,,
